CodCategoria;Categoria;Descricao;NomeDeGrupo
RAD112;Móveis, Decoração e Utensílios Domésticos;Acendedores, Apetrechos de Cozinha e de Bar, Artigos de Cama, Mesa e Banho, Artesanatos, Aquecedores a Gás, Copos e Cristais, Cozinhas, Cutelaria e Talheres, Equipamentos de Segurança e Comunicação Interna, Ferragens, Lâmpadas e Luminárias, Louças e Baixelas, Materiais de Construção, Materiais Sanitários, Panelas em Geral, Papéis de Parede, Persianas e Toldos, Pisos e Revestimentos, Tapetes e Carpetes, Tubos e Conexões.;Falso;
RAD113;Política e Eleições;Associações de Classe, Cargos Públicos e Privados, Partidos Políticos.;Falso;
RAD114;Produtos e Serviços Para Agropecuária;Adubos, Defensivos, Implementos, Inseticidas, Máquinas, Produtos Veterinários, Rações Animais, Sementes e Tratores.;Falso;
RAD115;Produtos e Serviços Automotivos;Aditivos, Acessórios e Peças, Carrocerias, Combustíveis, Lubrificantes, Oficinas Mecânicas e de Lanternagem, Pneus, Postos de Serviços, Recauchutagem, Sistemas de Segurança.;Falso;
RAD116;Produtos e Serviços Para Comércio e Escritório;Arquivos, Computadores, Copiadoras, Empresas Gráficas, Empresas de Limpeza, Empresas de Vale-Refeição e Assemelhados, Fax, Impressoras, Listas Telefônicas, Máquinas de Escrever, Máquinas de Calcular, Material de Escrita, Desenho e Papelaria, Móveis Profissionais, Serviços de Entrega, Serviços e Equipamentos de Manutenção e Segurança, Software e Suprimentos de Informática.;Falso;
RAD117;Produtos e Serviços Comunitários;Defesa da Ecologia, Campanhas Educativas de Qualquer Natureza (Trânsito, Eleição, Antidrogas etc), Entidades Filantrópicas e Beneméritas, Igrejas e Cultos, Serviços Assistenciais Públicos e Privados.;Falso;
RAD118;Produtos e Serviços Para A Indústria;Bens, Consultorias, Instalações, Insumos, Maquinarias, Pesquisas de Mercado, Serviços de Carga.;Falso;
RAD119;Produtos e Serviços De Lazer e Recreação;Aparelhagens de Áudio e de Vídeo, Aparelhagens de Ginástica ou Esportivas, Baralhos, Bicicletas, Binóculos e Lunetas, Brinquedos em Geral, Equipamento e Material Fotográfico, Fliperamas, Instrumentos Musicais, Jet-Skys, Jogos em Geral, Lanchas, Locadoras de Vídeo e Videogames, Loterias, Computadores e Tablets Pessoais, Modelismo, Projetores, Serviços de Revelação Fotográfica, Trailers, Videocâmeras, Videogravadores, Videogames e Cartuchos.;Falso;
RAD120;Produtos e Serviços De Limpeza e Manutenção Do Lar;Adesivos, Abrasivos, Amaciantes de Roupas, Assistências Técnicas e Serviços de Consertos, Ceras, Detergentes Líquidos e em Pó, Esponjas de Limpeza e Assemelhados, Equipamentos de Jardinagem, Equipamentos para Piscinas, Furadeiras, Gás Engarrafado, Inseticidas e Repelentes, Limpadores Concentrados e Multiuso, Lixeiras e Sacos para Lixo, Papéis Laminados, Papéis-Toalha, Pilhas, Sabões em Barra e Assemelhados, Solventes, Tintas, Vassouras, Velas.;Falso;
RAD121;Produtos e Serviços Médicos, Farmacêuticos e De Saúde;Academias de Ginástica, Ambulâncias e Serviços de Remoção, Adoçantes Artificiais, Analgésicos, Clínicas e Hospitais, Compostos Vitamínicos, Institutos de Beleza, Lentes de Contato e para Óculos, Medicamentos em Geral, Produtos Dietéticos ou Emagrecedores, Produtos para Curativos e Enfermagem (Esparadrapos etc.), Produtos Éticos, Spas, Tratamentos Capilares, Veterinárias.;Falso;
RAD122;Produtos e Serviços Públicos;Água e Esgotos, Cemitérios, Comunicações de Governo e Órgãos Públicos em Geral, Correios, Gás Encanado, Impostos, Luz, Obras Públicas, Paramédicos, Saúde Pública, Transportes Públicos, Segurança Pública.;Falso;
RAD123;Produtos e Serviços de Telecomunicações;Serviços de Telefonia Pública ou Privada, Local ou Interurbano, Sistemas e Equipamentos de Telefonia (inclusive Telefone Celular, ISDN, ADSL etc.) e Serviços de Atendimento Telefônico, Provedores de Acesso à Internet, Televisão a Cabo, Televisão por Satélite, Televisão por Assinatura.;Falso;
RAD124;Serviços Financeiros e De Seguros;Bancos, Bolsas de Valores, Câmbio e Cheques de Viagens, Capitalização, Cartões de Crédito, Consórcios, Corretoras e Distribuidoras de Valores, Empresas de Crédito e Poupança, Financeiras, Fundos e Investimentos, Seguros em Geral, Seguros de Saúde.;Falso;
RAD125;Turismo, Transportes e Diversões Públicas;Agências de Viagens, Campings, Casas Noturnas, Cassinos, Complexos e Destinos Turísticos, Empresas Aéreas e de Navegação, Feiras, Hotéis e Assemelhados, Jardins Botânicos, Jardins Zoológicos e Assemelhados, Parques Aquáticos, Parques de Diversões, Planetários, Serviços de Locação de Automóveis, Transportes Urbanos e Rodoviários.;Falso;
RAD126;Varejo De Grande Porte;Lojas de Departamento, Redes de Mais de 15 lojas de Qualquer Setor, Shopping Centers, Supermercados e sites de e-comércio de empresas que se enquadrem nesta categoria.;Falso;
RAD127;Varejo De Pequeno e Médio Porte;Armarinhos, Bares, Bazares, Butiques, Delicatessen, Farmácias e Drogarias, Lanchonetes e Fast food, Lojas de Conveniência, Óticas, Padarias e Confeitarias, Redes de Até 15 lojas de Qualquer Setor, Revendas e Concessionárias de Veículos, Restaurantes, Outras Lojas Especializadas, Sites de Leilões e sites de e-comercio de empresas que se enquadrem nesta categoria.;Falso;
RAD128;Veículos Pessoais e Profissionais;Automóveis de Passeio, Aviões, Caminhões, Furgões, Motos, Navios, Ônibus, Utilitários. Atenção: exclusivamente comunicação de marca.;Falso;
RAD129;Vestuário e Acessórios Pessoais;Adereços, Aviamentos, Armações de Óculos, Artigos de Couro, Bolsas e Malas, Calçados e Assemelhados, Jóias, Lãs e Linhas, Lingerie e Roupas Intimas, Relógios e Canetas Especiais, Roupas e Materiais Esportivos, Roupas Infantis, Femininas e Masculinas, Tecidos.;Falso;
RAD130;Websites, Portais e Serviços Online;Trabalhos voltados para a divulgação de sites na Internet. Atenção que a categoria não é para inscrição de Websites, mas de peças e campanhas que promovam websites, portais e serviços online de empresas e instituições.;Falso;
RAD131;Produtos e Serviços Diversos;Exclusivamente para os que não se encaixem nas categorias anteriores.;Falso;
RAD200;Apresentações Especiais;Categorias julgadas levando em conta seus formatos ou utilizações, independentemente do mercado do cliente.;Verdadeiro;
RAD201;Oportunidade;Trabalhos que denotem claramente terem sido criados aproveitando uma oportunidade inesperada (uma notícia, um acontecimento imprevisto etc.). Aqui também são válidos apenas trabalhos veiculados.;Falso;
RAD202;Datas Promocionais;Trabalhos publicitários referentes a datas como Natal, Dia das Mães, Dia dos Pais, Dia dos Namorados, Dia da Criança e Páscoa;Falso;
RAD203;Datas Institucionais;Trabalhos publicitários referentes a datas como aniversários, dias santos, dias comemorativos de profissionais etc.Diferenciam-se das Peças de Oportunidade porque podem ter sido criadas com antecedência.;Falso;
RAD204;Aproveitamento de Patrocínio;Trabalhos publicitários que aproveitem o fato de a empresa anunciante também estar patrocinando um evento ou ação de qualquer natureza..;Falso;
RAD205;Apoio a Promoção de Produto;Peça eletrônica veiculada em rádio para apoiar case ou ação promocional de produto, como sorteio, trocas, coleções e similares. Não se aplica a mera promoção de preços ou descontos.;Falso;
RAD206;Apoio a Promoção de Serviço;Peça eletrônica veiculada em rádio para apoiar case ou ação promocional de serviço, como sorteio, trocas, coleções e similares. Não se aplica a mera promoção de preços ou descontos..;Falso;
RPB000;RP;Trabalhos que demonstrem o uso criativo e inovador das técnicas de Relações Públicas, com o objetivo de implementar ou incrementar o entendimento entre organizações e marcas e seus públicos.;Verdadeiro;
RPB101;Ações Comunitárias e Não Lucrativas;Trabalhos conduzidos em nome de instituições de caridade e/ou organizações filantrópicas ou de conscientização de saúde, segurança, higiente, social etc.;Falso;
RPB102;Arte e Entretenimento;Trabalhos destinados a promover ou gerar o conhecimento de iniciativas artísticas ou de entretenimento.;Falso;
RPB103;Gerenciamento de Crise;Trabalhos desenvolvidos para lidar com situações não esperadas ou que exijam resposta imediata.;Falso;
RPB104;Marketing - Business to Business;Trabalhos destinados lançar ou promover produtos e serviços voltados para um público de negócios.;Falso;
RPB105;Público Interno;Trabalhos realizados para informar ou educar uma audiência interna, tais como funcionários ou colaboradores.;Falso;
RPB106;Relacionamento com Comunidade;Trabalhos direcionados a ampliar o relacionamento com comunidades nas quais a organização tenha interesse ou necessidade.;Falso;
RPB107;Relacionamento com Investidores;Trabalhos destinados a gerenciar e/ou transmitir informações aos investidores atuais e/ou potenciais de uma empresa.;Falso;
RPB108;Reputação;Trabalhos destinados a promover ou incrementar a reputação de uma organização junto a seus públicos.;Falso;
RPB109;Políticas Públicas;Trabalhos concebidos especificamente para influenciar autoridades, legisladores, órgãos públicos ou candidaturas.;Falso;
RPB110;Serviço Público;Trabalhos que promovam a compreensão do público sobre questões, problemas ou preocupações sociais.;Falso;
RPB111;Sustentabilidade e Ambiente;Trabalhos projetados para abordar questões verdes ou ambientais.;Falso;
TEC000;Técnica;Para a análise da qualidade de aspectos técnicos específicos da produção das peças de comunicação de marketing.;Verdadeiro;
TEC100;Filme ou Vídeo;Trabalhos produzidos com objetivo comercial, social ou institucional para exibição em qualquer suporte (televisão, cinema, internet, smartphones, tablets etc.);Verdadeiro;
TEC101;Roteiro de Filme ou Vídeo;Para julgamento da narrativa (diálogos e sequência de cenas) utilizada para transmitir a mensagem do cliente do trabalho.;Falso;
TEC102;Direção de Arte de Filme ou Vídeo;Para o julgamento da concepção visual (cenografia, figurinos e maquiagem) utilizada para transmitir a mensagem do cliente do trabalho.;Falso;
TEC103;Direção de Filme ou Vídeo;Para o julgamento do direcionamento dado ao conjunto das opções cinematográficas utilizadas para transmitir a mensagem do cliente do trabalho.;Falso;
TEC104;Produção de Filme ou Vídeo;Para o julgamento da eficácia das soluções encontradas para a viabilização do trabalho, segundo a sua complexidade técnica (locações, cenotécnica, figurinos, casting etc.);Falso;
TEC105;Fotografia de Filme ou Vídeo;Para o julgamento da concepção gráfica na captação das imagens, de forma a transmitir, com mais eficiência artística e emocional a mensagem do cliente no trabalho.;Falso;
TEC106;Edição de Filme ou Vídeo;Para o julgamento de como o sequenciamento de cenas colaborou de forma mais eficiente para transmitir a mensagem do cliente no trabalho.;Falso;
TEC107;Efeitos Visuais de Filme ou Vídeo;Para o julgamento de como a manipulação das imagens captadas colaboraram para a transmissão informativa e emocional da mensagem do cliente no trabalho.;Falso;
TEC108;Animação em Filme ou Vídeo;Para o julgamento das produções que não tenham utilizado captação direta das imagens e sim técnicas de animação quadro-a-quadro (stop motion, desenho, computação gráfica etc.);Falso;
TEC200;Áudio;Trabalhos produzidos com objetivo comercial, social ou institucional para execução em qualquer suporte (rádio, internet, carro de som, sistema de som de eventos etc.);Verdadeiro;
TEC201;Roteiro de Fonograma;Para julgamento da narrativa (diálogos e sequência de efeitos sonoros) utilizada para transmitir a mensagem do cliente do trabalho.;Falso;
TEC202;Música ou Trilha de Fonograma;Para o julgamento de como a concepção sonora (melodia, arranjo, efeitos sonoros etc.) ajudou a transmitir o conteúdo informativo e emocional da mensagem do cliente no trabalho.;Falso;
TEC203;Música ou Trilha de Filme ou Vídeo;Para o julgamento de como a concepção sonora ajudou a transmitir o conteúdo informativo e emocional da mensagem do cliente no trabalho.;Falso;
TEC204;Texto ou Letra de Fonograma;Para o julgamento específico do texto ou da letra do jingle redigidos para transmitir o conteúdo informativo e emocional da mensagem do cliente.;Falso;
TEC205;Texto ou Letra de Jingle em Filme ou Vídeo;Para o julgamento específico do texto ou da letra do jingle redigidos para transmitir o conteúdo informativo e emocional da mensagem do cliente.;Falso;
TEC206;Produção de Áudio;Para o julgamento da eficácia das soluções encontradas para a viabilização do trabalho, segundo a sua complexidade técnica (casting, músicos, efeitos etc.);Falso;
TEC300;Peças Gráficas;Trabalhos produzidos com objetivo comercial, social ou institucional para exibição em mídias gráficas (jornais ou revistas) e peças promocionais (folhetos, catálogos etc.);Verdadeiro;
TEC301;Texto em Peça Gráfica;Para o julgamento específico dos recursos de linguagem utilizados no título e no corpo do trabalho para transmitir o conteúdo informativo e emocional da mensagem do cliente.;Falso;
TEC302;Direção de Arte em Peça Gráfica;Para o julgamento específico das soluções visuais (layout, tipologia, imagens etc.) utilizadas no trabalho para transmitir o conteúdo informativo e emocional da mensagem do cliente.;Falso;
TEC303;Ilustração em Peça Gráfica;Para o julgamento da imagem utilizada no trabalho especificamente se produzida por qualquer técnica de ilustração (desenho, pintura, colagem, computação gráfica etc.).;Falso;
TEC304;Fotografia em Peça Gráfica;Para o julgamento da imagem utilizada no trabalho especificamente quando a sua primeira captação foi produzida por qualquer técnica de fotografia.;Falso;