CodCategoria;Categoria;Descricao;NomeDeGrupo
IMP125;Turismo, Transportes e Diversões Públicas;Agências de Viagens, Campings, Casas Noturnas, Cassinos, Complexos e Destinos Turísticos, Empresas Aéreas e de Navegação, Feiras, Hotéis e Assemelhados, Jardins Botânicos, Jardins Zoológicos e Assemelhados, Parques Aquáticos, Parques de Diversões, Planetários, Serviços de Locação de Automóveis, Transportes Urbanos e Rodoviários.;Falso;
IMP126;Varejo De Grande Porte;Lojas de Departamento, Redes de Mais de 15 lojas de Qualquer Setor, Shopping Centers, Supermercados e sites de e-comércio de empresas que se enquadrem nesta categoria.;Falso;
IMP127;Varejo De Pequeno e Médio Porte;Armarinhos, Bares, Bazares, Butiques, Delicatessen, Farmácias e Drogarias, Lanchonetes e Fast food, Lojas de Conveniência, Óticas, Padarias e Confeitarias, Redes de Até 15 lojas de Qualquer Setor, Revendas e Concessionárias de Veículos, Restaurantes, Outras Lojas Especializadas, Sites de Leilões e sites de e-comercio de empresas que se enquadrem nesta categoria.;Falso;
IMP128;Veículos Pessoais e Profissionais;Automóveis de Passeio, Aviões, Caminhões, Furgões, Motos, Navios, Ônibus, Utilitários. Atenção: exclusivamente comunicação de marca.;Falso;
IMP129;Vestuário e Acessórios Pessoais;Adereços, Aviamentos, Armações de Óculos, Artigos de Couro, Bolsas e Malas, Calçados e Assemelhados, Jóias, Lãs e Linhas, Lingerie e Roupas Intimas, Relógios e Canetas Especiais, Roupas e Materiais Esportivos, Roupas Infantis, Femininas e Masculinas, Tecidos.;Falso;
IMP130;Websites, Portais e Serviços Online;Trabalhos voltados para a divulgação de sites na Internet. Atenção que a categoria não é para inscrição de Websites, mas de peças e campanhas que promovam websites, portais e serviços online de empresas e instituições.;Falso;
IMP131;Produtos e Serviços Diversos;Exclusivamente para os que não se encaixem nas categorias anteriores.;Falso;
IMP200;Apresentações Especiais;Categorias julgadas levando em conta seus formatos ou utilizações, independentemente do mercado do cliente.;Verdadeiro;
IMP201;Anúncio De Até 45 Cm/Col Ou 1/2 Página De Revista;Categoria específica para pequenos anúncios, não importando o mercado do anunciante. No caso de anúncio de jornal, ele teria, por exemplo, até 3 colunas por 15 cm de altura ou qualquer outra combinação que gere até 45 cm/col.;Falso;
IMP202;Trade;Trabalhos destinados ao público intermediário do anunciante, não importando o mercado em que ele atue. Aqui também são válidos apenas trabalhos veiculados.;Falso;
IMP203;Oportunidade;Trabalhos que denotem claramente terem sido criados aproveitando uma oportunidade inesperada (uma notícia, um acontecimento imprevisto etc.). Aqui também são válidos apenas trabalhos veiculados.;Falso;
IMP204;Datas Promocionais;Trabalhos publicitários referentes a datas como Natal, Dia das Mães, Dia dos Pais, Dia dos Namorados, Dia da Criança e Páscoa;Falso;
IMP205;Datas Institucionais;Trabalhos publicitários referentes a datas como aniversários, dias santos, dias comemorativos de profissionais etc.Diferenciam-se das Peças de Oportunidade porque podem ter sido criadas com antecedência.;Falso;
IMP206;Aproveitamento de Patrocínio;Trabalhos publicitários que aproveitem o fato de a empresa anunciante também estar patrocinando um evento ou ação de qualquer natureza..;Falso;
INO000;Inovação;Trabalhos que revelem um ineditismo no uso das tecnologias, técnicas, pensamentos, estratégias e meios de comunicação, tendo conseguido por esta razão um impacto maior para a transmissão da mensagem comercial, social ou institucional do cliente envolvido e, eventualmente, a indicação de novos caminhos para a indústria.;Verdadeiro;
INO100;Cases;;Verdadeiro;
INO101;Case de Inovação;Não há segmentação de categorias no Colunistas Inovação.;Falso;
INT000;Mídias Integradas;Campanhas ou conjuntos de peças de objetivo comercial, social ou institucional que demonstrem a integração de um mesmo conceito ou ideia criativa entre os diversos meios utilizados.;Verdadeiro;
INT100;Mercado;Categorias em que também se levará em conta a adequação ao tipo de produto ou serviço anunciado.;Verdadeiro;
INT101;Alimentos;Achocolatados, Balas, Biscoitos, Bombons, Caldos e Sopas, Carnes, Cereais, Chocolates, Condimentos, Confeitos, Enlatados, Frios, Frutas, Iogurtes Cremosos ou Líquidos, Guloseimas, Leite e Derivados, Manteigas, Margarinas e Assemelhados, Massas, Misturas ou Produtos Pré e Semipreparados, Molhos, Pães e Bolos, Rações para Animais Domésticos, Salgados, Sobremesas, Sorvetes;Falso;
INT102;Bebidas Alcoólicas;Aguardentes, Aperitivos, Cervejas, Chopp, Destilados, Licores, Vinhos.;Falso;
INT103;Bebidas Não-Alcoólicas;Águas Minerais, Café, Chá, Coolers, Energéticos, Isotônicos, Mate, Refrescos em Pó, Refrigerantes, Sucos Naturais e Artificiais.;Falso;
INT104;Cigarros e Tabaco;Cachimbos, Charutos, Cigarrilhas, Cigarros, Fumo em Geral, Papel para Enrolar Fumo.;Falso;
INT105;Cosméticos e Produtos De Toalete;Absorventes, Antiperspirantes e Desodorantes, Aparelhos e Lâminas de Barbear, Bronzeadores ou Protetores Solares, Cotonetes, Cremes e Fios Dentais, Escovas e Pentes em Geral, Fraldas, Papéis Sanitários, Sabonetes e outros Produtos para o Banho, Perfumes e Essências, Produtos de Maquiagem em Geral, Tinturas.;Falso;
INT106;Cultura e Educação;Colégios, Cursos em Geral, Exposições, Fascículos, Festivais, Filmes, Filmes em Vídeo, Gravações Musicais em Disco, Cassete ou CD, Livros, Operas, Peças Teatrais, Shows Musicais, Universidades.;Falso;
INT107;Eletrodomésticos;Aspiradores de Pó, Batedeiras, Cafeteiras, Chuveiros Elétricos e Duchas Elétricas, Enceradeiras, Espremedores, Fogões, Fornos, Freezers, Fritadeiras, Geladeiras, Lava-Louças, Lava-Pratos, Liqüidificadores, Máquinas de Costura, Multiprocessadores, Secadoras, Torradeiras, Ventiladores.;Falso;
INT108;Imobiliário;Administradoras de Imóveis, Locação e Vendas (de Apartamentos, Apart-Hotéis, Casas, Centros Comerciais e Shopping Centers, Condomínios, Escritórios, Fazendas, Lojas, Lotes e Terrenos).;Falso;
INT109;Institucional Ou Corporativo;Trabalhos para qualquer tipo de anunciante, mas que não tenham nenhuma referência específica a determinado produto ou serviço e sim à imagem da empresa ou corporação como um todo.;Falso;
INT110;Meios De Comunicação;Emissoras de Rádio, Emissoras de Televisão, Jornais, Revistas, Sites ou Portais de Notícias.;Falso;
INT111;Mercado Publicitário;Agências de Propaganda, Agências de Promoções, Agências de Web-Design, Produtoras de Áudio, Foto e Vídeo.;Falso;
INT112;Móveis, Decoração e Utensílios Domésticos;Acendedores, Apetrechos de Cozinha e de Bar, Artigos de Cama, Mesa e Banho, Artesanatos, Aquecedores a Gás, Copos e Cristais, Cozinhas, Cutelaria e Talheres, Equipamentos de Segurança e Comunicação Interna, Ferragens, Lâmpadas e Luminárias, Louças e Baixelas, Materiais de Construção, Materiais Sanitários, Panelas em Geral, Papéis de Parede, Persianas e Toldos, Pisos e Revestimentos, Tapetes e Carpetes, Tubos e Conexões.;Falso;
INT113;Política e Eleições;Associações de Classe, Cargos Públicos e Privados, Partidos Políticos.;Falso;
INT114;Produtos e Serviços Para Agropecuária;Adubos, Defensivos, Implementos, Inseticidas, Máquinas, Produtos Veterinários, Rações Animais, Sementes e Tratores.;Falso;
INT115;Produtos e Serviços Automotivos;Aditivos, Acessórios e Peças, Carrocerias, Combustíveis, Lubrificantes, Oficinas Mecânicas e de Lanternagem, Pneus, Postos de Serviços, Recauchutagem, Sistemas de Segurança.;Falso;
INT116;Produtos e Serviços Para Comércio e Escritório;Arquivos, Computadores, Copiadoras, Empresas Gráficas, Empresas de Limpeza, Empresas de Vale-Refeição e Assemelhados, Fax, Impressoras, Listas Telefônicas, Máquinas de Escrever, Máquinas de Calcular, Material de Escrita, Desenho e Papelaria, Móveis Profissionais, Serviços de Entrega, Serviços e Equipamentos de Manutenção e Segurança, Software e Suprimentos de Informática.;Falso;
INT117;Produtos e Serviços Comunitários;Defesa da Ecologia, Campanhas Educativas de Qualquer Natureza (Trânsito, Eleição, Antidrogas etc), Entidades Filantrópicas e Beneméritas, Igrejas e Cultos, Serviços Assistenciais Públicos e Privados.;Falso;
INT118;Produtos e Serviços Para A Indústria;Bens, Consultorias, Instalações, Insumos, Maquinarias, Pesquisas de Mercado, Serviços de Carga.;Falso;
INT119;Produtos e Serviços De Lazer e Recreação;Aparelhagens de Áudio e de Vídeo, Aparelhagens de Ginástica ou Esportivas, Baralhos, Bicicletas, Binóculos e Lunetas, Brinquedos em Geral, Equipamento e Material Fotográfico, Fliperamas, Instrumentos Musicais, Jet-Skys, Jogos em Geral, Lanchas, Locadoras de Vídeo e Videogames, Loterias, Computadores e Tablets Pessoais, Modelismo, Projetores, Serviços de Revelação Fotográfica, Trailers, Videocâmeras, Videogravadores, Videogames e Cartuchos.;Falso;
INT120;Produtos e Serviços De Limpeza e Manutenção Do Lar;Adesivos, Abrasivos, Amaciantes de Roupas, Assistências Técnicas e Serviços de Consertos, Ceras, Detergentes Líquidos e em Pó, Esponjas de Limpeza e Assemelhados, Equipamentos de Jardinagem, Equipamentos para Piscinas, Furadeiras, Gás Engarrafado, Inseticidas e Repelentes, Limpadores Concentrados e Multiuso, Lixeiras e Sacos para Lixo, Papéis Laminados, Papéis-Toalha, Pilhas, Sabões em Barra e Assemelhados, Solventes, Tintas, Vassouras, Velas.;Falso;
INT121;Produtos e Serviços Médicos, Farmacêuticos e De Saúde;Academias de Ginástica, Ambulâncias e Serviços de Remoção, Adoçantes Artificiais, Analgésicos, Clínicas e Hospitais, Compostos Vitamínicos, Institutos de Beleza, Lentes de Contato e para Óculos, Medicamentos em Geral, Produtos Dietéticos ou Emagrecedores, Produtos para Curativos e Enfermagem (Esparadrapos etc.), Produtos Éticos, Spas, Tratamentos Capilares, Veterinárias.;Falso;
INT122;Produtos e Serviços Públicos;Água e Esgotos, Cemitérios, Comunicações de Governo e Órgãos Públicos em Geral, Correios, Gás Encanado, Impostos, Luz, Obras Públicas, Paramédicos, Saúde Pública, Transportes Públicos, Segurança Pública.;Falso;
INT123;Produtos e Serviços de Telecomunicações;Serviços de Telefonia Pública ou Privada, Local ou Interurbano, Sistemas e Equipamentos de Telefonia (inclusive Telefone Celular, ISDN, ADSL etc.) e Serviços de Atendimento Telefônico, Provedores de Acesso à Internet, Televisão a Cabo, Televisão por Satélite, Televisão por Assinatura.;Falso;
INT124;Serviços Financeiros e De Seguros;Bancos, Bolsas de Valores, Câmbio e Cheques de Viagens, Capitalização, Cartões de Crédito, Consórcios, Corretoras e Distribuidoras de Valores, Empresas de Crédito e Poupança, Financeiras, Fundos e Investimentos, Seguros em Geral, Seguros de Saúde.;Falso;
INT125;Turismo, Transportes e Diversões Públicas;Agências de Viagens, Campings, Casas Noturnas, Cassinos, Complexos e Destinos Turísticos, Empresas Aéreas e de Navegação, Feiras, Hotéis e Assemelhados, Jardins Botânicos, Jardins Zoológicos e Assemelhados, Parques Aquáticos, Parques de Diversões, Planetários, Serviços de Locação de Automóveis, Transportes Urbanos e Rodoviários.;Falso;
INT126;Varejo De Grande Porte;Lojas de Departamento, Redes de Mais de 15 lojas de Qualquer Setor, Shopping Centers, Supermercados e sites de e-comércio de empresas que se enquadrem nesta categoria.;Falso;
INT127;Varejo De Pequeno e Médio Porte;Armarinhos, Bares, Bazares, Butiques, Delicatessen, Farmácias e Drogarias, Lanchonetes e Fast food, Lojas de Conveniência, Óticas, Padarias e Confeitarias, Redes de Até 15 lojas de Qualquer Setor, Revendas e Concessionárias de Veículos, Restaurantes, Outras Lojas Especializadas, Sites de Leilões e sites de e-comercio de empresas que se enquadrem nesta categoria.;Falso;
INT128;Veículos Pessoais e Profissionais;Automóveis de Passeio, Aviões, Caminhões, Furgões, Motos, Navios, Ônibus, Utilitários. Atenção: exclusivamente comunicação de marca.;Falso;
INT129;Vestuário e Acessórios Pessoais;Adereços, Aviamentos, Armações de Óculos, Artigos de Couro, Bolsas e Malas, Calçados e Assemelhados, Jóias, Lãs e Linhas, Lingerie e Roupas Intimas, Relógios e Canetas Especiais, Roupas e Materiais Esportivos, Roupas Infantis, Femininas e Masculinas, Tecidos.;Falso;
INT130;Websites, Portais e Serviços Online;Trabalhos voltados para a divulgação de sites na Internet. Atenção que a categoria não é para inscrição de Websites, mas de peças e campanhas que promovam websites, portais e serviços online de empresas e instituições.;Falso;
INT131;Produtos e Serviços Diversos;Exclusivamente para os que não se encaixem nas categorias anteriores.;Falso;
MID000;Mídia;Trabalhos que demonstrem o uso criativo das características específicas da mídia utilizada e estratégias inovadoras implementadas pelos veículos de comunicação para que seus anunciantes atinjam com mais eficiência seus públicos alvo.;Verdadeiro;
MID100;Aproveitamento de Mídia;;Verdadeiro;
MID101;Aproveitamento do Meio Televisão;Trabalhos publicitários que apresentem soluções criativas e inovadoras de formato ou planejamento de veiculação em televisão.;Falso;
MID102;Aproveitamento do Meio Cinema;Trabalhos publicitários apresentem soluções criativas e inovadoras de formato ou planejamento de veiculação em cinema.;Falso;
MID103;Aproveitamento do Meio Rádio;Trabalhos publicitários que apresentem soluções criativas e inovadoras de formato ou planejamento de veiculação em rádio.;Falso;
MID104;Aproveitamento do Meio Jornal;Trabalhos publicitários que apresentem soluções criativas e inovadoras de formato ou planejamento de veiculação em jornal.;Falso;
MID105;Aproveitamento do Meio Revista;Trabalhos publicitários que apresentem soluções criativas e inovadoras de formato ou planejamento de veiculação em revista.;Falso;
MID106;Aproveitamento da Mídia Exterior;Trabalhos publicitários que apresentem soluções criativas e inovadoras de formato ou planejamento de veiculação em mídia exterior.;Falso;
MID107;Aproveitamento da Mídia Digital;Trabalhos publicitários que apresentem soluções criativas e inovadoras de formato ou planejamento de veiculação em mídias digitais baseadas em desktops ou notebooks;Falso;
MID108;Aproveitamento da Mídia Mobile;Trabalhos publicitários que apresentem soluções criativas e inovadoras de formato ou planejamento de veiculação em equipamentos mobile (celulares e tablets);Falso;
PRM000;Promo e Live;Peças ou estratégias de comunicação que gerem obrigatoriamente uma ação no receptor da mensagem, além da simples aquisição do produto ou serviço diretamente no ponto-de-venda.;Verdadeiro;
PRM100;Cases Promocionais e de Live Marketing;Projetos de média e longa duração, que envolvem diferentes ações e materiais, permitindo uma análise comparativa entre a situação anterior do mercado e os resultados obtidos.;Verdadeiro;
PRM101;Case de Produto de Consumo;Alimentos, Guloseimas, Bebidas Alcoólicas e Não-Alcoólicas, Medicamentos, Suplementos, Cosméticos, Produtos de Toalete, etc.;Falso;
PRM102;Case de Bens Duráveis;Bens de Capital e Produtos de Consumo de Uso Duradouro, como Automóveis, Mobiliário, Eletrodomésticos etc.;Falso;
PRM103;Case de Serviço;Financeiros, Telecomunicações, Médicos etc.;Falso;
PRM104;Case de Produto ou Serviço Técnico ou Profissional;Manutenção de Equipamentos, Softwares para Uso Profissional, Serviços de Entrega, etc.;Falso;
PRM105;Case de Produto ou Serviço Business-to-Business;Inclui Comércio, Indústria e Agropecuária;Falso;
PRM106;Case de Varejo;Obrigatoriamente assinado por empresa de varejo, como rede de lojas, supermercado, shopping etc.;Falso;
PRM107;Case de Produto Cultural ou de Lazer;Exposições, Filmes, Brinquedos, Eletrônicos, Mídia etc.;Falso;
PRM108;Case Institucional;Que reverta em benefício da marca da empresa ou de seus produtos.;Falso;
PRM109;Case Social ou Comunitário;Que, através do envolvimento do público alvo da marca, gere resultados em benefício da comunidade.;Falso;
PRM110;Case de Endomarketing e Incentivo;Que seja voltado para públicos internos ou intermediários ou estimule os usuários a participar de programa contínuo que vise ao atingimento de metas de venda, consumo ou comportamento pré-determinados.;Falso;
PRM111;Case de Fidelização e Pós-Venda;Que reuna ações e materiais que atinjam o público alvo após a venda com o objetivo de fortalecer o seu relacionamento com a marca.;Falso;
PRM112;Organização de Congressos, Seminários e Afins;Todo o conjunto de ações e materiais desenvolvidos para o lançamento, a comunicação e a realização de encontros voltados a reuniões de pessoas com afinidades temáticas ou profissionais para fins de trocas de informações.;Falso;
PRM113;Organização de Feiras e Exposições;Todo o conjunto de ações e materiais desenvolvidos para o lançamento, a comunicação e a realização de exibições de empresas com afinidades temáticas ou profissionais, para fins de promoção ou comercialização de seus produtos e serviços.;Falso;
PRM200;Eventos Promocionais e de Live Marketing;Projetos de curta duração que objetivem reunir o público-alvo em local e datas pré-determinados.;Verdadeiro;
PRM201;Evento Comercial;Que permita a venda local de produto, bem ou serviço.;Falso;
PRM202;Evento Comunitário;Que, através do envolvimento do público alvo da marca, gere resultados em benefício da comunidade.;Falso;
PRM203;Evento Cultural ou de Lazer;Que utilize formas de lazer ou atrativo cultural para atrair ou informar o público alvo.;Falso;
PRM204;Evento de Endomarketing ou Incentivo;Que seja voltado para públicos internos ou intermediários ou estimule os usuários a participar de programa contínuo que vise ao atingimento de metas de venda, consumo ou comportamento pré-determinados.;Falso;
PRM205;Evento de Inauguração;Que reúna o público alvo para a apresentação de novas instalações industriais, comerciais ou culturais.;Falso;
PRM206;Evento de Lançamento de Produto ou Serviço;Que reúna o público alvo para a apresentação de novos produtos ou linhas de produtos ou serviços.;Falso;
PRM207;Evento Esportivo;Que utilize atividades esportivas para atrair ou informar o público alvo.;Falso;
PRM208;Evento Institucional;Que vise exclusivamente a promover a imagem ou o relacionamento da marca junto ao público alvo.;Falso;
PRM209;Evento Relacionado a Data Comemorativa;Que utilize a oportunidadade de aniversários, dias santos e datas promocionais para atrair ou informar o público alvo.;Falso;
PRM210;Evento Social;Evento realizado por empresa ou profissional de marketing promocional, mas não necessariamente voltado para clientes corporativos.;Falso;
PRM211;Evento Técnico;Seminários, simpósios, workshops, convenções, treinamento etc.;Falso;
PRM212;Participação em Feira ou Exposição;Conjunto de atividades, estruturas e materiais desenvolvidos durante a participação da empresa em feira ou exposição.;Falso;
PRM300;Ações Promocionais e de Live Marketing;Projetos de curta duração ou abrangência restrita, normalmente realizados sem conhecimento prévio do público-alvo sobre seus locais e/ou datas.;Verdadeiro;
PRM301;Ação de Demonstração ou Amostragem em Ponto-de-Venda;Degustação, distribuição de amostras, folhetos ou demais materiais promocionais em local em que o produto possa ser adquirido pelo público alvo.;Falso;
PRM302;Ação de Demonstração ou Amostragem Externa;Degustação, distribuição de amostras, folhetos ou demais materiais promocionais em local em que não haja a venda do produto para o público alvo.;Falso;
PRM303;Ação para Bens Duráveis;Bens de capital e produtos de consumo de uso duradouro, como automóveis, mobiliário, eletrodomésticos etc.;Falso;
PRM304;Ação de Endomarketing ou Incentivo;Que seja voltada para públicos internos ou intermediários ou estimule os usuários a participar de programa contínuo que vise ao atingimento de metas de venda, consumo ou comportamento pré-determinados.;Falso;
PRM305;Ação Institucional;Que reverta em benefício da marca da empresa ou de seus produtos;Falso;
PRM306;Ação para Produto ou Serviço Business-to-Business;Inclui Comércio, Indústria e Agropecuária;Falso;
PRM307;Ação para Produto de Consumo;Alimentos, Guloseimas, Bebidas Alcoólicas e Não-Alcoólicas, Medicamentos, Suplementos, Cosméticos, Produtos de Toalete, etc.;Falso;
PRM308;Ação para Produto Cultural ou de Lazer;Exposições, Filmes, Brinquedos, Eletrônicos, Mídia etc.;Falso;
PRM309;Ação para Serviço;Financeiros, Telecomunicações, Médicos etc.;Falso;
PRM310;Ação para Produto ou Serviço Técnico ou Profissional;Manutenção de Equipamentos, Softwares para Uso Profissional, Serviços de Entrega, etc.;Falso;
PRM311;Ação Social ou Comunitária;Que, através do envolvimento do público alvo da marca, gere resultados em benefício da comunidade.;Falso;
PRM312;Ação para Varejo;Obrigatoriamente assinada por empresa de varejo, como rede de lojas, supermercado, shopping etc.;Falso;
PRM313;Ação em Rede Social;Que necessariamente utilize alguma rede social, como Facebook, Google+, etc. como plataforma de desenvolvimento e participação do público alvo.;Falso;
PRM400;Materiais Promocionais;Peças distribuidas gratuitamente para gerar conhecimento ou relacionamento da marca junto ao público alvo ou, no caso de peças de mídia, que obrigatoriamente sejam utilizadas para promover ou apoiar projetos de marketing promocional.;Verdadeiro;
PRM401;Brinde ou Peça Promocional dirigida a Públicos Internos ou Intermediários;Peça distribuida ao público interno ou intermediário do cliente com fins promocionais ou institucionais.;Falso;
PRM402;Brinde ou Peça Promocional dirigida ao Público Final;Peça distribuida ao público final do cliente com fins promocionais ou institucionais.;Falso;
PRM403;Brinde ou Peça Promocional relativa a Data Comemorativa;Natal, aniversário, dia santo, etc.;Falso;
PRM404;Peça Promocional Interativa;Que se utilize exclusivamente de mídia como websites, e-mails, CD-ROM ou celulares, como meio de interação com o público alvo.);Falso;
PRM405;Brinde ou Peça Promocional de Empresa de Comunicação;Agência de publicidade, empresa de promoções, produtora etc.;Falso;
PRM406;Personagem Promocional;Personagem ou família de personagens utilizados graficamente ou materializados em campanha, evento ou ação promocional.;Falso;
PRM407;Figurino Promocional;Figurino utilizado por receptivo, promotores, atores etc durante evento ou ação promocional.;Falso;
RAD000;Rádio;Jingles, spots e outros materiais produzidos para o meio radiofônico.;Verdadeiro;
RAD100;Mercado;Categorias em que também se levará em conta a adequação ao tipo de produto ou serviço anunciado.;Verdadeiro;
RAD101;Alimentos;Achocolatados, Balas, Biscoitos, Bombons, Caldos e Sopas, Carnes, Cereais, Chocolates, Condimentos, Confeitos, Enlatados, Frios, Frutas, Iogurtes Cremosos ou Líquidos, Guloseimas, Leite e Derivados, Manteigas, Margarinas e Assemelhados, Massas, Misturas ou Produtos Pré e Semipreparados, Molhos, Pães e Bolos, Rações para Animais Domésticos, Salgados, Sobremesas, Sorvetes;Falso;
RAD102;Bebidas Alcoólicas;Aguardentes, Aperitivos, Cervejas, Chopp, Destilados, Licores, Vinhos.;Falso;
RAD103;Bebidas Não-Alcoólicas;Águas Minerais, Café, Chá, Coolers, Energéticos, Isotônicos, Mate, Refrescos em Pó, Refrigerantes, Sucos Naturais e Artificiais.;Falso;
RAD104;Cigarros e Tabaco;Cachimbos, Charutos, Cigarrilhas, Cigarros, Fumo em Geral, Papel para Enrolar Fumo.;Falso;
RAD105;Cosméticos e Produtos De Toalete;Absorventes, Antiperspirantes e Desodorantes, Aparelhos e Lâminas de Barbear, Bronzeadores ou Protetores Solares, Cotonetes, Cremes e Fios Dentais, Escovas e Pentes em Geral, Fraldas, Papéis Sanitários, Sabonetes e outros Produtos para o Banho, Perfumes e Essências, Produtos de Maquiagem em Geral, Tinturas.;Falso;
RAD106;Cultura e Educação;Colégios, Cursos em Geral, Exposições, Fascículos, Festivais, Filmes, Filmes em Vídeo, Gravações Musicais em Disco, Cassete ou CD, Livros, Operas, Peças Teatrais, Shows Musicais, Universidades.;Falso;
RAD107;Eletrodomésticos;Aspiradores de Pó, Batedeiras, Cafeteiras, Chuveiros Elétricos e Duchas Elétricas, Enceradeiras, Espremedores, Fogões, Fornos, Freezers, Fritadeiras, Geladeiras, Lava-Louças, Lava-Pratos, Liqüidificadores, Máquinas de Costura, Multiprocessadores, Secadoras, Torradeiras, Ventiladores.;Falso;
RAD108;Imobiliário;Administradoras de Imóveis, Locação e Vendas (de Apartamentos, Apart-Hotéis, Casas, Centros Comerciais e Shopping Centers, Condomínios, Escritórios, Fazendas, Lojas, Lotes e Terrenos).;Falso;
RAD109;Institucional Ou Corporativo;Trabalhos para qualquer tipo de anunciante, mas que não tenham nenhuma referência específica a determinado produto ou serviço e sim à imagem da empresa ou corporação como um todo.;Falso;
RAD110;Meios De Comunicação;Emissoras de Rádio, Emissoras de Televisão, Jornais, Revistas, Sites ou Portais de Notícias.;Falso;
RAD111;Mercado Publicitário;Agências de Propaganda, Agências de Promoções, Agências de Web-Design, Produtoras de Áudio, Foto e Vídeo.;Falso;
