CodCategoria;Categoria;Descricao;NomeDeGrupo
BRC000;Branded Content;Trabalhos que utilizem formatos de conteúdo cultural, artístico ou informativo -- não tradicionalmente publicitários -- como suporte para a comunicação original de uma marca ou organização.;Verdadeiro;
BRC101;Ficção para TV ou Cinema;Drama, comédia ou mini-série;Falso;
BRC102;Ficção Online;Séries ou filmes criados para internet ou para plataformas sociais.;Falso;
BRC103;Não Ficção para TV ou Cinema;Drama, comédia ou mini-série;Falso;
BRC104;Não Ficção Online;Séries ou filmes criados para internet ou para plataformas sociais.;Falso;
BRC105;Publicação Impressa;Livro, revista, etc.;Falso;
BRC106;Presença de Marca em Conteúdo Cultural;Product Placement (Inserções de marca ou de imagens de produto ou serviço em filmes, programas de televisão, etc.);Falso;
BRC107;Uso da Marca em Redes Sociais;Incorporação da marca em postagens nas redes sociais, como Facebook, Instagram, Linkedin, Whatsapp, YouTube, etc.;Falso;
BRC108;Conteúdo Gerado por Usuários;Utilização de materiais produzidos pelo público em comunicação promocional ou institucional da marca.;Falso;
DES000;Design;Peças de comunicação que mereçam destaque por sua técnica e excelência artística com o propósito não apenas funcional, mas de inspirar e motivar o público alvo.;Verdadeiro;
DES100;Cases de Design;Projetos de média e longa duração, que envolvem o diagnóstico do problema de comunicação visual do cliente, o estabelecimento de estratégias criativas e a aplicação do material criado como solução.;Verdadeiro;
DES101;Case de Design Ambiental;Cases que apresentem os problemas, as estratégias e as soluções adotadas para aplicação em ambiente interno ou externo da empresa, para informar, orientar ou interagir com o público-alvo.;Falso;
DES102;Case de Branding ou Design Corporativo;Cases que apresentem os problemas, as estratégias e as soluções adotadas para definir uma imagem única e especial para a empresa. Inclui Programa de Branding e Identidade Corporativa.;Falso;
DES103;Case de Design de Embalagem;Cases que apresentem os problemas, as estratégias e as soluções adotadas para o acondicionamento de produtos do cliente.;Falso;
DES104;Case de Responsabilidade Social em Design;Cases que apresentem as soluções de design de comunicação que tenham gerado benefícios para a sociedade, através de sustentabilidade, proteção ao meio ambiente, melhoria no acesso aos produtos ou serviços, distribuição de renda, educação etc.;Falso;
DES200;Design Ambiental;Peça ou conjunto de peças que interfira no ambiente em que for instalado ou se utilize dele para informar, orientar ou interagir com o público-alvo.;Verdadeiro;
DES201;Peça ou Conjunto de Peças de Sinalização;Materiais criados com a finalidade de informar ou orientar o público-alvo quanto à melhor utilização do espaço em questão.;Falso;
DES202;Peça ou Conjunto de Peças de Merchandising de Produto;Materiais criados para aplicação em pontos-de-venda, com a finalidade de promover produtos do cliente.;Falso;
DES203;Peça ou Conjunto de Materiais de Merchandising de Serviço;Materiais criados para aplicação em pontos-de-venda, com a finalidade de promover serviços do cliente.;Falso;
DES204;Banner, Faixa ou Estandarte;Material rígido ou flexível, de utilização temporária, utilizado na decoração ou comunicação de informações relativas ao cliente. Atenção: não é banner digital;Falso;
DES205;Cartaz de Produto de Consumo;Peça gráfica para afixação em paredes, muros ou assemelhados, criada para a comunicação de produto de consumo.;Falso;
DES206;Cartaz de Serviço;Peça gráfica para afixação em paredes, muros ou assemelhados, criada para a comunicação de serviço.;Falso;
DES207;Cartaz de Produto Cultural ou de Lazer;Peça gráfica para afixação em paredes, muros ou assemelhados, criada para a comunicação de produto cultural ou de lazer.;Falso;
DES208;Cartaz Social ou Comunitário;Peça gráfica para afixação em paredes, muros ou assemelhados, criada com objetivos sociais ou comunitários.;Falso;
DES209;Decoração de Loja ou Vitrine;Modificações realizadas em ponto-de-venda com o objetivo de destacar produto ou oportunidade promocional.;Falso;
DES210;Display de Solo;Peça utilizada para a exibição de produto, colocada em ponto-de-venda necessariamente à altura do solo.;Falso;
DES211;Display de Balcão ou de Vitrine;Peça utilizada para a exibição de produto, colocada em ponto-de-venda necessariamente em balcão ou vitrine.;Falso;
DES212;Display Expositor ou Dispenser;Peça utilizada para a exibição e retirada do produto, folheto ou outro material promocional por parte do consumidor.;Falso;
DES213;Balcão ou Quiosque;Estrutura, usualmente temporária, instalada em ambientes de circulação do público-alvo, com finalidade de venda ou demonstração de produto ou serviço.;Falso;
DES214;Estande para Feira ou Exposição;Estande instalado em feiras, exposições ou outros eventos multimarcas. Nesta categoria, julga-se o projeto de design do estande, não as ações nele desenvolvidas.;Falso;
DES215;Cenografia para Evento Promocional;Conjunto de peças utilizadas para a ambientação, identificação e sinalização de evento promocional.;Falso;
DES300;Branding e Design Corporativo;Peça ou conjunto de peças para uso da comunicação de marketing do cliente e que se aproveitem ou reforcem, da forma mais criativa e funcional, da identidade visual da empresa.;Verdadeiro;
DES301;Papelaria;Conjunto de peças de mesma identidade visual a serem utilizadas no ambiente de escritório do cliente e em suas interações pessoais, tais como papel de carta, envelope, pastas de documentos etc.;Falso;
DES302;Identidade Visual para Frota de Veículos;Aplicação da marca ou outros elementos gráficos do cliente em sua frota de veículos.;Falso;
DES303;Assinatura, Selo ou Vinheta;Peça de pequenas dimensões ou duração, para identificação da empresa quando aplicada em outros materiais visuais ou objetos.;Falso;
DES304;Marca, Símbolo Gráfico ou Logotipo;Elemento gráfico utilizado para identificar, de forma única, qualquer empresa ou indivíduo.;Falso;
DES305;Design em Material Promocional;Aplicação de programação visual institucional ou promocional em amostras e brindes diversos (canecas, camisetas etc);Falso;
DES306;Capa de Disco, CD ou DVD;Inclusive CD-Rom e DVD, promocional ou artístico.;Falso;
DES307;Capa de Livro ou Caderno;Promocional ou artístico.;Falso;
DES308;Programa, Convite ou Comunicado;Peça destinada a informar sobre evento, encontro, decisões etc.;Falso;
DES309;Broadside;Peça gráfica normalmente utilizada em lançamento de produto, serviço ou ação promocional, com informações sobre a campanha desenvolvida a respeito.;Falso;
DES310;Folheto Promocional;Peça gráfica produzida com poucas folhas, não encadernada, para distribuição personalizada ou em displays take-one.;Falso;
DES311;Material Técnico ou Informativo;Catálogo, Manual, Apresentação etc.;Falso;
DES312;Publicação Promocional Periódica;Newsletter, house-organ ou similar, que possa comprovar a periodicidade. É fundamental apresentar mais de uma edição para a avaliação.;Falso;
DES313;Calendário;Em qualquer formato: de mesa, de parede, objeto etc.;Falso;
DES314;Relatório de Diretoria;Peça gráfica normalmente produzida ao final de exercícios fiscais com o objetivo de informar aos acionistas de uma empresa sobre as realizações da diretoria no período. Também engloba Relatórios Sociais.;Falso;
DES315;Troféu ou Símbolo Tridimensional;Objeto entregue por mérito ou vitória a competidores de disputas de qualquer natureza.;Falso;
DES400;Design de Embalagem;Peça ou conjunto de peças para o acondicionamento de produtos de natureza diversa.;Verdadeiro;
DES401;Design de Embalagem em Madeira;Peça com design original em madeira para utilização de armazenamento e transporte de produto.;Falso;
DES402;Design de Embalagem em Metal;;Falso;
DES403;Design de Embalagem em Papel, Papelão ou Similar;Peça com design original em papel, papelão ou similar para utilização de armazenamento e transporte de produto.;Falso;
DES404;Design de Embalagem em Plástico, Sintético ou Similar;Peça com design original em plástico, sintético ou similar para utilização de armazenamento e transporte de produto.;Falso;
DES405;Design de Embalagem em Vidro;Peça com design original em vidro para utilização de armazenamento e transporte de produto.;Falso;
DES406;Embalagem Display;Embalagem que também possa ser utilizada em balcões ou vitrines para a exibição do produto.;Falso;
DES407;Embalagem Multipack;Embalagem que acondicione mais de um item de produto, da mesma linha ou não.;Falso;
DES408;Embalagem ou Rótulo de Alimento ou Bebida;Arte aplicada em embalagem já padronizada para acondicionamento de alimento ou bebida.;Falso;
DES409;Embalagem ou Rótulo de Produto de Uso Pessoal;Arte aplicada em embalagem já padronizada para acondicionamento de produtos de uso pessoal.;Falso;
DES410;Embalagem ou Rótulo de Produto para o Lar;Arte aplicada em embalagem já padronizada para acondicionamento de produto para o lar.;Falso;
DES411;Embalagem ou Rótulo de Produto Técnico ou Profissional;Arte aplicada em embalagem já padronizada para acondicionamento de produto técnico ou profissional.;Falso;
DES412;Embalagem Promocional;Embalagem desenvolvida como peça integrante de campanha promocional.;Falso;
DES413;Saco, Sacola ou Papel para Embrulho;Inclusive Papel de Presente.;Falso;
DIG000;Digital;Banners, popups, layers, websites, hotsites, etc. destinados a visualização através de suportes digitais, como smartphones, tablets, computadores etc.;Verdadeiro;
DIG100;Mercado;Categorias em que também se levará em conta a adequação ao tipo de produto ou serviço anunciado.;Verdadeiro;
DIG101;Alimentos;Achocolatados, Balas, Biscoitos, Bombons, Caldos e Sopas, Carnes, Cereais, Chocolates, Condimentos, Confeitos, Enlatados, Frios, Frutas, Iogurtes Cremosos ou Líquidos, Guloseimas, Leite e Derivados, Manteigas, Margarinas e Assemelhados, Massas, Misturas ou Produtos Pré e Semipreparados, Molhos, Pães e Bolos, Rações para Animais Domésticos, Salgados, Sobremesas, Sorvetes;Falso;
DIG102;Bebidas Alcoólicas;Aguardentes, Aperitivos, Cervejas, Chopp, Destilados, Licores, Vinhos.;Falso;
DIG103;Bebidas Não-Alcoólicas;Águas Minerais, Café, Chá, Coolers, Energéticos, Isotônicos, Mate, Refrescos em Pó, Refrigerantes, Sucos Naturais e Artificiais.;Falso;
DIG104;Cigarros e Tabaco;Cachimbos, Charutos, Cigarrilhas, Cigarros, Fumo em Geral, Papel para Enrolar Fumo.;Falso;
DIG105;Cosméticos e Produtos De Toalete;Absorventes, Antiperspirantes e Desodorantes, Aparelhos e Lâminas de Barbear, Bronzeadores ou Protetores Solares, Cotonetes, Cremes e Fios Dentais, Escovas e Pentes em Geral, Fraldas, Papéis Sanitários, Sabonetes e outros Produtos para o Banho, Perfumes e Essências, Produtos de Maquiagem em Geral, Tinturas.;Falso;
DIG106;Cultura e Educação;Colégios, Cursos em Geral, Exposições, Fascículos, Festivais, Filmes, Filmes em Vídeo, Gravações Musicais em Disco, Cassete ou CD, Livros, Operas, Peças Teatrais, Shows Musicais, Universidades.;Falso;
DIG107;Eletrodomésticos;Aspiradores de Pó, Batedeiras, Cafeteiras, Chuveiros Elétricos e Duchas Elétricas, Enceradeiras, Espremedores, Fogões, Fornos, Freezers, Fritadeiras, Geladeiras, Lava-Louças, Lava-Pratos, Liqüidificadores, Máquinas de Costura, Multiprocessadores, Secadoras, Torradeiras, Ventiladores.;Falso;
DIG108;Imobiliário;Administradoras de Imóveis, Locação e Vendas (de Apartamentos, Apart-Hotéis, Casas, Centros Comerciais e Shopping Centers, Condomínios, Escritórios, Fazendas, Lojas, Lotes e Terrenos).;Falso;
DIG109;Institucional Ou Corporativo;Trabalhos para qualquer tipo de anunciante, mas que não tenham nenhuma referência específica a determinado produto ou serviço e sim à imagem da empresa ou corporação como um todo.;Falso;
DIG110;Meios De Comunicação;Emissoras de Rádio, Emissoras de Televisão, Jornais, Revistas, Sites ou Portais de Notícias.;Falso;
DIG111;Mercado Publicitário;Agências de Propaganda, Agências de Promoções, Agências de Web-Design, Produtoras de Áudio, Foto e Vídeo.;Falso;
DIG112;Móveis, Decoração e Utensílios Domésticos;Acendedores, Apetrechos de Cozinha e de Bar, Artigos de Cama, Mesa e Banho, Artesanatos, Aquecedores a Gás, Copos e Cristais, Cozinhas, Cutelaria e Talheres, Equipamentos de Segurança e Comunicação Interna, Ferragens, Lâmpadas e Luminárias, Louças e Baixelas, Materiais de Construção, Materiais Sanitários, Panelas em Geral, Papéis de Parede, Persianas e Toldos, Pisos e Revestimentos, Tapetes e Carpetes, Tubos e Conexões.;Falso;
DIG113;Política e Eleições;Associações de Classe, Cargos Públicos e Privados, Partidos Políticos.;Falso;
DIG114;Produtos e Serviços Para Agropecuária;Adubos, Defensivos, Implementos, Inseticidas, Máquinas, Produtos Veterinários, Rações Animais, Sementes e Tratores.;Falso;
DIG115;Produtos e Serviços Automotivos;Aditivos, Acessórios e Peças, Carrocerias, Combustíveis, Lubrificantes, Oficinas Mecânicas e de Lanternagem, Pneus, Postos de Serviços, Recauchutagem, Sistemas de Segurança.;Falso;
DIG116;Produtos e Serviços Para Comércio e Escritório;Arquivos, Computadores, Copiadoras, Empresas Gráficas, Empresas de Limpeza, Empresas de Vale-Refeição e Assemelhados, Fax, Impressoras, Listas Telefônicas, Máquinas de Escrever, Máquinas de Calcular, Material de Escrita, Desenho e Papelaria, Móveis Profissionais, Serviços de Entrega, Serviços e Equipamentos de Manutenção e Segurança, Software e Suprimentos de Informática.;Falso;
DIG117;Produtos e Serviços Comunitários;Defesa da Ecologia, Campanhas Educativas de Qualquer Natureza (Trânsito, Eleição, Antidrogas etc), Entidades Filantrópicas e Beneméritas, Igrejas e Cultos, Serviços Assistenciais Públicos e Privados.;Falso;
DIG118;Produtos e Serviços Para A Indústria;Bens, Consultorias, Instalações, Insumos, Maquinarias, Pesquisas de Mercado, Serviços de Carga.;Falso;
DIG119;Produtos e Serviços De Lazer e Recreação;Aparelhagens de Áudio e de Vídeo, Aparelhagens de Ginástica ou Esportivas, Baralhos, Bicicletas, Binóculos e Lunetas, Brinquedos em Geral, Equipamento e Material Fotográfico, Fliperamas, Instrumentos Musicais, Jet-Skys, Jogos em Geral, Lanchas, Locadoras de Vídeo e Videogames, Loterias, Computadores e Tablets Pessoais, Modelismo, Projetores, Serviços de Revelação Fotográfica, Trailers, Videocâmeras, Videogravadores, Videogames e Cartuchos.;Falso;
DIG120;Produtos e Serviços De Limpeza e Manutenção Do Lar;Adesivos, Abrasivos, Amaciantes de Roupas, Assistências Técnicas e Serviços de Consertos, Ceras, Detergentes Líquidos e em Pó, Esponjas de Limpeza e Assemelhados, Equipamentos de Jardinagem, Equipamentos para Piscinas, Furadeiras, Gás Engarrafado, Inseticidas e Repelentes, Limpadores Concentrados e Multiuso, Lixeiras e Sacos para Lixo, Papéis Laminados, Papéis-Toalha, Pilhas, Sabões em Barra e Assemelhados, Solventes, Tintas, Vassouras, Velas.;Falso;
DIG121;Produtos e Serviços Médicos, Farmacêuticos e De Saúde;Academias de Ginástica, Ambulâncias e Serviços de Remoção, Adoçantes Artificiais, Analgésicos, Clínicas e Hospitais, Compostos Vitamínicos, Institutos de Beleza, Lentes de Contato e para Óculos, Medicamentos em Geral, Produtos Dietéticos ou Emagrecedores, Produtos para Curativos e Enfermagem (Esparadrapos etc.), Produtos Éticos, Spas, Tratamentos Capilares, Veterinárias.;Falso;
DIG122;Produtos e Serviços Públicos;Água e Esgotos, Cemitérios, Comunicações de Governo e Órgãos Públicos em Geral, Correios, Gás Encanado, Impostos, Luz, Obras Públicas, Paramédicos, Saúde Pública, Transportes Públicos, Segurança Pública.;Falso;
DIG123;Produtos e Serviços de Telecomunicações;Serviços de Telefonia Pública ou Privada, Local ou Interurbano, Sistemas e Equipamentos de Telefonia (inclusive Telefone Celular, ISDN, ADSL etc.) e Serviços de Atendimento Telefônico, Provedores de Acesso à Internet, Televisão a Cabo, Televisão por Satélite, Televisão por Assinatura.;Falso;
DIG124;Serviços Financeiros e De Seguros;Bancos, Bolsas de Valores, Câmbio e Cheques de Viagens, Capitalização, Cartões de Crédito, Consórcios, Corretoras e Distribuidoras de Valores, Empresas de Crédito e Poupança, Financeiras, Fundos e Investimentos, Seguros em Geral, Seguros de Saúde.;Falso;
DIG125;Turismo, Transportes e Diversões Públicas;Agências de Viagens, Campings, Casas Noturnas, Cassinos, Complexos e Destinos Turísticos, Empresas Aéreas e de Navegação, Feiras, Hotéis e Assemelhados, Jardins Botânicos, Jardins Zoológicos e Assemelhados, Parques Aquáticos, Parques de Diversões, Planetários, Serviços de Locação de Automóveis, Transportes Urbanos e Rodoviários.;Falso;
DIG126;Varejo De Grande Porte;Lojas de Departamento, Redes de Mais de 15 lojas de Qualquer Setor, Shopping Centers, Supermercados e sites de e-comércio de empresas que se enquadrem nesta categoria.;Falso;
DIG127;Varejo De Pequeno e Médio Porte;Armarinhos, Bares, Bazares, Butiques, Delicatessen, Farmácias e Drogarias, Lanchonetes e Fast food, Lojas de Conveniência, Óticas, Padarias e Confeitarias, Redes de Até 15 lojas de Qualquer Setor, Revendas e Concessionárias de Veículos, Restaurantes, Outras Lojas Especializadas, Sites de Leilões e sites de e-comercio de empresas que se enquadrem nesta categoria.;Falso;
DIG128;Veículos Pessoais e Profissionais;Automóveis de Passeio, Aviões, Caminhões, Furgões, Motos, Navios, Ônibus, Utilitários. Atenção: exclusivamente comunicação de marca.;Falso;
DIG129;Vestuário e Acessórios Pessoais;Adereços, Aviamentos, Armações de Óculos, Artigos de Couro, Bolsas e Malas, Calçados e Assemelhados, Jóias, Lãs e Linhas, Lingerie e Roupas Intimas, Relógios e Canetas Especiais, Roupas e Materiais Esportivos, Roupas Infantis, Femininas e Masculinas, Tecidos.;Falso;
DIG130;Websites, Portais e Serviços Online;Trabalhos voltados para a divulgação de sites na Internet. Atenção que a categoria não é para inscrição de Websites, mas de peças e campanhas que promovam websites, portais e serviços online de empresas e instituições.;Falso;
DIG131;Produtos e Serviços Diversos;Exclusivamente para os que não se encaixem nas categorias anteriores.;Falso;
DIG200;Apresentações Especiais;Categorias julgadas levando em conta seus formatos ou utilizações, independentemente do mercado do cliente.;Verdadeiro;
DIG201;Oportunidade;Trabalhos que denotem claramente terem sido criados aproveitando uma oportunidade inesperada (uma notícia, um acontecimento imprevisto etc.). Aqui também são válidos apenas trabalhos veiculados.;Falso;
DIG202;Datas Promocionais;Trabalhos publicitários referentes a datas como Natal, Dia das Mães, Dia dos Pais, Dia dos Namorados, Dia da Criança e Páscoa;Falso;
DIG203;Datas Institucionais;Trabalhos publicitários referentes a datas como aniversários, dias santos, dias comemorativos de profissionais etc.Diferenciam-se das Peças de Oportunidade porque podem ter sido criadas com antecedência.;Falso;
DIG204;Ação de Comunicação em Rede Social;Comunicação publicitária ou institucional que atinja seu público alvo através de redes sociais como Facebook, Twitter, Google+ etc;Falso;
DIG205;Peça Interativa;Trabalhos publicitários que de alguma forma interajam com o seu público alvo.;Falso;
DIG206;Fanpage em Mídia Social;Páginas de mídia social assinadas pelo anunciante para relacionamento com seu público-alvo.;Falso;
DIG207;Jogo Online;Trabalhos que comuniquem os objetivos de marketing do cliente através de jogos com pontuação e/ou disputa entre os participantes.;Falso;
DIG300;Websites;Canais de comunicação online de empresas ou instituições para fins de mercado, institucionais, sociais, projetos temporários etc. e que estejam disponibilizados em endereço (URL) próprio.;Verdadeiro;
DIG301;Website de Produto de Consumo;Alimentos, Guloseimas, Bebidas Alcoólicas e Não-Alcoólicas, Medicamentos, Suplementos, Cosméticos, Produtos de Toalete, etc.;Falso;
DIG302;Website de Bens Duráveis;Bens de Capital e Produtos de Consumo de Uso Duradouro, como Automóveis, Mobiliário, Eletrodomésticos etc.;Falso;
DIG303;Website de Serviço;Financeiros, Telecomunicações, Médicos etc.;Falso;
DIG304;Website de Produto ou Serviço Técnico ou Profissional;Manutenção de Equipamentos, Softwares para Uso Profissional, Serviços de Entrega, etc.;Falso;
DIG305;Website de Produto ou Serviço Business-to-Business;Inclui Comércio, Indústria e Agropecuária;Falso;
DIG306;Website de Varejo;Obrigatoriamente assinada por empresa de varejo, como rede de lojas, supermercado, shopping etc.;Falso;
DIG307;Website de Produto Cultural ou de Lazer;Exposições, Filmes, Brinquedos, Eletrônicos, Mídia etc.;Falso;
DIG308;Website Social ou Comunitário;Website Social ou Comunitário;Falso;
DIG309;Website de Endomarketing e Incentivo;Que seja voltado para públicos internos ou intermediários ou estimule os usuários a participar de programa contínuo que vise ao atingimento de metas de venda, consumo ou comportamento pré-determinados.;Falso;
DIG310;Website de Produtos e Serviços Diversos;Exclusivamente para os que não se encaixem nas categorias anteriores.;Falso;
DIR000;Marketing Direto;Peças produzidas para atingir um público previamente determinado ou que permitam um controle ou mensuração das suas respostas.;Verdadeiro;
DIR100;Campanhas ou Programas;Conjuntos de ações e peças que permitam uma análise da estratégia utilizada, da integração entre as diversas iniciativas e dos resultados obtidos.;Verdadeiro;
DIR101;Campanha ou Programa de Produto ou Serviço Business-to-Business;Conjunto de peças de marketing direto voltadas para o clientes empresarial.;Falso;
DIR102;Campanha ou Programa de Venda de Produto;Conjunto de peças de marketing direto direcionada a venda de produtos de qualquer natureza.;Falso;
DIR103;Campanha ou Programa de Venda de Serviço;Conjunto de peças de marketing direto direcionada a venda de produtos de qualquer natureza.;Falso;
DIR104;Campanha ou Programa de Fidelização;Iniciativas que visem desenvolver fidelização e relacionamento com o cliente exclusivamente através de ações e peças de marketing direto..;Falso;
DIR105;Campanha ou Programa Social ou Comunitário;Conjunto de ações e peças de marketing direto direcionada a iniciativas sem fins lucrativos, educacionais ou de caridade.;Falso;
DIR106;Programa de Database Marketing;Conjunto de estratégias e ações baseados no gerenciamento de informações sobre o público alvo do cliente.;Falso;
DIR200;Peças de Marketing Direto;Materiais que poderão ser analisados pela sua adequação ao meio e sua técnica, como direção de arte, redação, produção etc.;Verdadeiro;
DIR201;Peça de Mídia Eletrônica;Peça de marketing direto (que permita uma resposta mensurável ou personalizada) produzida para rádio ou tv.;Falso;
DIR202;Peça de Mídia Impressa;Peça de marketing direto (que permita uma resposta mensurável ou personalizada) produzida para jornal ou revista.;Falso;
DIR203;Peça de Mídia Digital;Peça de marketing direto (que permita uma resposta mensurável ou personalizada) produzida para internet, tablet ou smartphone.;Falso;
DIR204;Peça de Distribuição Domiciliar;Peça de marketing direto (que permita uma resposta mensurável ou personalizada) produzida para entrega porta-a-porta.;Falso;
DIR205;Peça Tridimensional;Peça de marketing direto, no formato de objeto ou similar, com o objetivo de obter uma resposta mensurável ou personalizada.;Falso;
DIR206;Peça Interativa;Peça de marketing direto que estimule a interatividade do público-alvo, produzida como CD-ROM, e-mail, website etc.;Falso;
DIR207;Uso Criativo de Base de Dados;Solução inovadora desenvolvida a partir da análse da base de dados de clientes mantida pela empresa ou instituição..;Falso;
EXT000;Mídia Exterior;Peças exibidas fora de casa (Out-Of-Home ou OOH), englobando áreas externas e internas de lugares onde haja livre circulação de pessoas, podendo ser estáticas, móveis ou digitais.;Verdadeiro;
EXT100;Mercado;Categorias em que também se levará em conta a adequação ao tipo de produto ou serviço anunciado.;Verdadeiro;
EXT101;Alimentos;Achocolatados, Balas, Biscoitos, Bombons, Caldos e Sopas, Carnes, Cereais, Chocolates, Condimentos, Confeitos, Enlatados, Frios, Frutas, Iogurtes Cremosos ou Líquidos, Guloseimas, Leite e Derivados, Manteigas, Margarinas e Assemelhados, Massas, Misturas ou Produtos Pré e Semipreparados, Molhos, Pães e Bolos, Rações para Animais Domésticos, Salgados, Sobremesas, Sorvetes;Falso;
EXT102;Bebidas Alcoólicas;Aguardentes, Aperitivos, Cervejas, Chopp, Destilados, Licores, Vinhos.;Falso;
EXT103;Bebidas Não-Alcoólicas;Águas Minerais, Café, Chá, Coolers, Energéticos, Isotônicos, Mate, Refrescos em Pó, Refrigerantes, Sucos Naturais e Artificiais.;Falso;
EXT104;Cigarros e Tabaco;Cachimbos, Charutos, Cigarrilhas, Cigarros, Fumo em Geral, Papel para Enrolar Fumo.;Falso;
EXT105;Cosméticos e Produtos De Toalete;Absorventes, Antiperspirantes e Desodorantes, Aparelhos e Lâminas de Barbear, Bronzeadores ou Protetores Solares, Cotonetes, Cremes e Fios Dentais, Escovas e Pentes em Geral, Fraldas, Papéis Sanitários, Sabonetes e outros Produtos para o Banho, Perfumes e Essências, Produtos de Maquiagem em Geral, Tinturas.;Falso;
EXT106;Cultura e Educação;Colégios, Cursos em Geral, Exposições, Fascículos, Festivais, Filmes, Filmes em Vídeo, Gravações Musicais em Disco, Cassete ou CD, Livros, Operas, Peças Teatrais, Shows Musicais, Universidades.;Falso;
